{
  "inputMode": "argv",
  "argv": [
    "curl",
    "--proxy",
    "https://proxy.example",
    "https://example.com"
  ],
  "parseMode": "strict",
  "runtimeProfile": {
    "curlVersion": "8.20.0",
    "protocols": [
      "http",
      "https"
    ],
    "features": [
      "SSL",
      "HTTP2",
      "HTTP3"
    ],
    "compile": {
      "availableOptions": null,
      "disabledOptions": [],
      "defines": []
    },
    "schemaVersion": "curl-runtime-profile/v1"
  },
  "schemaVersion": "curl-parse-input/v1"
}
